<?xml version="1.0" encoding="iso-8859-1" ?>
<xs:schema xmlns:xs="http://www.w3.org/2001/XMLSchema">
<xs:element name="Users">
	<xs:complexType>
		<xs:sequence>
			<xs:element name="User" maxOccurs="unbounded">
				<xs:complexType>
					<xs:sequence>
						<xs:element name="Username">
						<xs:simpleType>
						<xs:restriction base="xs:string">
						<xs:pattern value="[A-Z][a-z]+"></xs:pattern>
						</xs:restriction>
						</xs:simpleType>
						</xs:element>
						<xs:element name="Password">
						<xs:simpleType>
						<xs:restriction base="xs:string">
						<xs:pattern value="[a-z]+[@][0-9]+"></xs:pattern>
						</xs:restriction>
						</xs:simpleType>
						</xs:element>
						<xs:element name="Type">
						<xs:simpleType>
						<xs:restriction base="xs:string">
						<xs:enumeration value="seller"></xs:enumeration>
						<xs:enumeration value="customer"></xs:enumeration>
						</xs:restriction>
						</xs:simpleType>
						</xs:element>
						<xs:element name="EmailID">
						<xs:simpleType>
						<xs:restriction base="xs:string">
						<xs:pattern value="[a-z]+[@][a-z]+[.][com]+"></xs:pattern>
						</xs:restriction>
						</xs:simpleType>
						</xs:element>
					</xs:sequence>
				</xs:complexType>
			</xs:element>
		</xs:sequence>
	</xs:complexType>
</xs:element>
</xs:schema>